{
  "$schema": "https://raw.githubusercontent.com/KayChung17/arknights-base-skill/main/marketplace.schema.json",
  "name": "arknights-base-skill",
  "version": "1.0.0",
  "repository": "https://github.com/KayChung17/arknights-base-skill",
  "skills": [
    {
      "name": "ark-base-schedule",
      "path": "skills/ark-base-schedule"
    },
    {
      "name": "update-ark-skills",
      "path": "skills/update-ark-skills"
    }
  ]
}
